{
  "accepted_release": "d8a4ffb5b63eb9359a4c0af9134b4f9a3c529618",
  "accepted_tree": "72ad841cc5b3cffc5f82979a9739b7fd03d75e15",
  "bundle": {
    "format": 2,
    "path": "history.bundle",
    "sha256": "56c401a24130fd37231d667fdbad3f5578587bb6a1c6d3c406698bd5a966537f",
    "size": 6633053
  },
  "dependencies": {
    "git": "SHA-1 Git with bundle v2",
    "pypdf": "6.10.0",
    "python": "3.13"
  },
  "files": [
    {
      "path": "OFFLINE_REPRODUCTION.md",
      "sha256": "8e170ea2b501daee120cfc961165211ae4c06e87d494d108977022943f6d419b",
      "size": 6077
    },
    {
      "path": "accepted-source-receipts.json",
      "sha256": "abdd45287f9e558d0900dd13661a856065c0ef77b33f6f0f203101dbbb52c12c",
      "size": 23520
    },
    {
      "path": "evidence/R-c10-artifact-metadata.json",
      "sha256": "2508adeef48c85d72fdb9ad59297f8ddf8435802a4cde942d9f099219ddbe025",
      "size": 708
    },
    {
      "path": "evidence/R-c10.zip",
      "sha256": "75d61c01020f63d7f9555f10f32de9d63a09c0107536463ae549cdb85ebe9fc8",
      "size": 9377
    },
    {
      "path": "evidence/acceptance-comment.json",
      "sha256": "681b77544e478171d1e98d46fbc025532ec5a4c45265e44695d167a3255a8da4",
      "size": 6708
    },
    {
      "path": "evidence/acquisition-index.json",
      "sha256": "41f0ff8617f5a8f52ac8bc1a742634fa29ba6c3c194ccd8f901f5e99b0d89e4a",
      "size": 17116
    },
    {
      "path": "evidence/final-code-review-comment.json",
      "sha256": "75ed1db9b3f035547a127203f25fd801924b646e8eab740e67f49bd3fd6db1d3",
      "size": 4229
    },
    {
      "path": "evidence/final-review-submissions.json",
      "sha256": "94e7dbef94ce2a72e6fb9b302b9198c31bcab0b466ebc17548b65ac899ae3acc",
      "size": 18684
    },
    {
      "path": "evidence/pr76.json",
      "sha256": "56ec33b7ba6f2334a35ba5faf9ed10f0e08965c1a3c52ec99cb6d3cafcbdd6e9",
      "size": 20594
    },
    {
      "path": "evidence/review-pages/1.json",
      "sha256": "72f527d9c4116544f9360d1b4fd26596d6193d1e44177a672b83f464cc4142e5",
      "size": 15720
    },
    {
      "path": "evidence/review-threads.json",
      "sha256": "df7468602c62b4bc0229d856fc82ead04cac211a41f42ba1aef8d71f7d93005a",
      "size": 21424
    },
    {
      "path": "evidence/runs/39045919531-jobs.json",
      "sha256": "acbc48a32937ecfbf04ddbb65e70363053c9e067faca8d3a9eb7961fb58910c1",
      "size": 2067
    },
    {
      "path": "evidence/runs/39045919531.json",
      "sha256": "c63a06a3d3bf41e440787b685ddc375630414f7fa50114db43554ba2732f07f9",
      "size": 12744
    },
    {
      "path": "evidence/runs/39045919534-jobs.json",
      "sha256": "17351137c348159ea4e237f219bc8da610db68594917ed360cf5a575180603b4",
      "size": 3665
    },
    {
      "path": "evidence/runs/39045919534.json",
      "sha256": "684731a2dc0ee29435f6afa5e5dfbf0cedfa11dbf1e323ed292a657127f750e9",
      "size": 12761
    },
    {
      "path": "evidence/runs/39045919547-jobs.json",
      "sha256": "519e085a361e211661164f3ead4dadb2a7d3ffbb0fde757a33b7cad23ab8451e",
      "size": 2923
    },
    {
      "path": "evidence/runs/39045919547.json",
      "sha256": "d2ea6f015832fbc31a1aa424ba48496dab50f6d9aa9b5b1a9b02d747f346eda7",
      "size": 12798
    },
    {
      "path": "evidence/runs/39045919577-jobs.json",
      "sha256": "4c57a610909857a9e79d0d9f4a2989f14bfda1cd444081e2f73a547ec9ad8387",
      "size": 2656
    },
    {
      "path": "evidence/runs/39045919577.json",
      "sha256": "6e08899dee82d6eca2ec792478d2ccc70932cd9e30fecd07034deee8bedf1e8b",
      "size": 12771
    },
    {
      "path": "evidence/runs/39045919601-jobs.json",
      "sha256": "70d556f00f1c8690f97fc463daf2bad741c8a9d2ca3917e14415649a5d7fb18e",
      "size": 5338
    },
    {
      "path": "evidence/runs/39045919601.json",
      "sha256": "3dfb32a54c039bd3accc32f4d0a1f1ca0043ef991775bcb2eb26afb5f1e60d93",
      "size": 12766
    },
    {
      "path": "evidence/runs/job-117434492474-logs.json",
      "sha256": "b69acc4f08e96bba69f9d9a4b417adeee6bd92385307b21c789cd469b8d7ff91",
      "size": 630030
    },
    {
      "path": "evidence/runs/job-117434492541-logs.json",
      "sha256": "3c9788666fb4ef9077ab0ff444944e8deca6a5ef5f1e92beb1fa830f3c5dfc37",
      "size": 169816
    },
    {
      "path": "evidence/runs/job-117434492645-logs.json",
      "sha256": "25fa97ad040ea46a1cab6955f3d675080d619b50a5939ed0c7880bb3ab5e5661",
      "size": 35224
    },
    {
      "path": "evidence/runs/job-117434492666-logs.json",
      "sha256": "1f1adfd94415dc4153bb06f78c3d6d11135564b479079d9dc9455075a9b81a5c",
      "size": 28949
    },
    {
      "path": "evidence/runs/job-117434492716-logs.json",
      "sha256": "5a1831533f9097431826d9d0d06cd5d3a08b86eac37d750a95f01bae970b4548",
      "size": 37429
    },
    {
      "path": "evidence/runs/job-117434492945-logs.json",
      "sha256": "c786455568c53b53babe88266ba428d572407ec12de7f1f2dff3d74975bafd96",
      "size": 37654
    },
    {
      "path": "evidence/runs/source-head-runs.json",
      "sha256": "43372faa7226c436a0085793aa40646e8612b1445a9b4e5ac2449ebf247b6594",
      "size": 63880
    },
    {
      "path": "evidence/thread-comment-pages/1.json",
      "sha256": "2fc8ff2459862772bea3bbad20630e9b8109d355b26590ecd3ad9b7cb7285e83",
      "size": 275201
    },
    {
      "path": "evidence/thread-comment-pages/2.json",
      "sha256": "37517e5f3dc66819f61f5a7bb8ace1921282415f10551d2defa5c3eb0985b570",
      "size": 3
    },
    {
      "path": "evidence/thread-pages/1.json",
      "sha256": "c28793619c6444e0d221202d4b42f6dfe266d2c5af5f285a411428fd33f28ae7",
      "size": 23432
    },
    {
      "path": "history.bundle",
      "sha256": "56c401a24130fd37231d667fdbad3f5578587bb6a1c6d3c406698bd5a966537f",
      "size": 6633053
    },
    {
      "path": "objects.jsonl",
      "sha256": "4bf97a05e5a0957b2a4df69f9b5465af625778d24d1dfeac7b5cf561870288ac",
      "size": 1351605
    },
    {
      "path": "refs.json",
      "sha256": "cc426fd98c9ab293c95ec96efa19203fd5336477ac93691c3067f36e8a30192c",
      "size": 7470
    },
    {
      "path": "tooling/verification/archive/.gitattributes",
      "sha256": "a79691a93b46e49ce460c26ef22afcc03d6eca1e63bf2edbc20e96159510f6c9",
      "size": 14
    },
    {
      "path": "tooling/verification/archive/__init__.py",
      "sha256": "3359d38379de1974b18468c7740c36e945ba33cab7c1b21959857003f62328d4",
      "size": 79
    },
    {
      "path": "tooling/verification/archive/_offline_worker.py",
      "sha256": "e4f145c610ad6845d8b26a1118a932e8f683c71a6f291bea7e7755ac21c67fd1",
      "size": 1832
    },
    {
      "path": "tooling/verification/archive/acquire_evidence.py",
      "sha256": "c520c7f603a6393e4d37a97349f21987fc5adb56f7e12b9276d03880d24d10a2",
      "size": 31205
    },
    {
      "path": "tooling/verification/archive/create_bundle.py",
      "sha256": "9bb2ee672c20133e1e360f88bc55ff939ab36102a8fe72c590326c5c64e60256",
      "size": 15616
    },
    {
      "path": "tooling/verification/archive/manifest.py",
      "sha256": "87ddc5f6525907d1a1a5795df47ecc1d87170f236b77b6f7cb4fb201c0d798c1",
      "size": 9363
    },
    {
      "path": "tooling/verification/archive/offline_smoke.py",
      "sha256": "1f66fb12a747373a1787e41629b5ec47552fecf9178d94b64aa8df7bedce800e",
      "size": 9872
    },
    {
      "path": "tooling/verification/archive/schemas/archive-manifest.schema.json",
      "sha256": "bc4894907c01c96b9218086fa744f50ca5b9810072e8760958a402364d29e581",
      "size": 2671
    },
    {
      "path": "tooling/verification/archive/tests/__init__.py",
      "sha256": "4501eb9ce86161d092a51edca9c252f303eb37d105cc7ebf9cafde75b007b9b6",
      "size": 78
    },
    {
      "path": "tooling/verification/archive/tests/test_archive.py",
      "sha256": "d71117a52d005b8e0909e0f6fad295c87ce4f9c68b27e6ae4608db4679ac8632",
      "size": 37137
    },
    {
      "path": "tooling/verification/archive/verify_bundle.py",
      "sha256": "9a1f1e63d78f58cd6cc295fdd51854ad98d575233415cb4d7c2a47aaed4dbd39",
      "size": 19797
    },
    {
      "path": "tooling/verification/integrity/.gitattributes",
      "sha256": "a79691a93b46e49ce460c26ef22afcc03d6eca1e63bf2edbc20e96159510f6c9",
      "size": 14
    },
    {
      "path": "tooling/verification/integrity/__init__.py",
      "sha256": "dd1c0d3e8fa49689d208ea6b7d228504cce82da613385d90dca5cd1e619f66b7",
      "size": 82
    },
    {
      "path": "tooling/verification/integrity/_tex_worker.py",
      "sha256": "bc9182d40424e71b8dbeecf75f8a72ccf610ffd665988724012bb56fffe0a91f",
      "size": 2890
    },
    {
      "path": "tooling/verification/integrity/ci_context.py",
      "sha256": "5ce429464b2bd437c1313e810dc11d58d123e30df8735fc95907620eb13179fe",
      "size": 6177
    },
    {
      "path": "tooling/verification/integrity/git_objects.py",
      "sha256": "ab12c3cf09050f86ed5b775584994fd434a62d678ea1b17d9fece378562910b1",
      "size": 16891
    },
    {
      "path": "tooling/verification/integrity/inventory.py",
      "sha256": "3ca49659a6ae9d7305f8f1e06f4fa4565d0ff5c1991f81901722190b8bfde972",
      "size": 6856
    },
    {
      "path": "tooling/verification/integrity/policy.py",
      "sha256": "51bd2fa5334ba4c06c8182fe7488591d2f57935d07aa32ef7dcb604634b74406",
      "size": 2745
    },
    {
      "path": "tooling/verification/integrity/preservation.py",
      "sha256": "01e347cf73f5fa6492ce989fb9f9f7f8d3d27208b4a6f8d6e2142dc478ac05cc",
      "size": 7470
    },
    {
      "path": "tooling/verification/integrity/reports.py",
      "sha256": "30c78bc185ead29a9bcb294b5d317393a35ce7676e89cb451f12c92d0a086266",
      "size": 4078
    },
    {
      "path": "tooling/verification/integrity/requirements.txt",
      "sha256": "ca60608eafae48e26e3dd19ea4f36379e7fc6f8ef0446dc8732e2c2f08d9957d",
      "size": 91
    },
    {
      "path": "tooling/verification/integrity/run_tests.py",
      "sha256": "3bd2fd1f16f376cd7a23dff91859e407ff21d2c12c8238e6e06397212713f0e5",
      "size": 8487
    },
    {